{
  "id": "pdca-evolution-schema-follows-reality",
  "cycle_phase": "act",
  "hypothesis": "logic/governance-evolution.schema.json enums for artifact_type and event.type no longer match real entries in state/evolution/. Updating the schema to extend the enums with the in-use values (and continuing to update them as new event types emerge) will let validation succeed on real data and remove a hidden source of cycle-time noise.",
  "plan": {
    "description": "Extend artifact_type enum with [meta, capability]. Extend event.type enum with [compounding_cycle, pattern_detected, governance_concept_created, cross_repo_validation, kaizen_proposal, gap_identified, violated]. Add a migration note recording legacy vs new superset. Run a JSON-schema validator against all state/evolution/*.json to confirm.",
    "success_criteria": "All 12 evolution files validate cleanly under the updated schema. No semantic drift in existing entries (no field renames, only enum extensions).",
    "risks": [
      "Cementing accidental vocabulary — review whether event types should consolidate (e.g. is 'gap_identified' really distinct from 'pattern_detected'?) before extending blindly",
      "Schema drift becomes a habit — pair this with a CI validator so future drifts surface within a day, not 27"
    ],
    "target_date": "2026-05-05"
  },
  "do": {
    "action_taken": "Extended artifact_type enum to [constitution, policy, persona, schema, contract, meta, capability, skill, runtime_code] (added 4 vs originally proposed — discovered 'skill' and 'runtime_code' as additional legacy values during validation). Extended event.type enum with the 6 proposed compound-cycle event types. Added schema-follows-reality discipline note in the descriptions. Ran inline Python JSON validator against all 11 evolution files.",
    "completed_at": "2026-05-01T00:00:00Z"
  },
  "check": {
    "success_criteria_met": true,
    "evidence": "Validator output: '11 valid, 0 invalid' across state/evolution/*.evolution.json. No field renames, only enum extensions. Schema is now strictly a superset of all real usage. Note: 'violated' was already in the original enum, so no extension needed there despite it appearing in the proposal description.",
    "checked_at": "2026-05-01T00:00:00Z"
  },
  "created_at": "2026-05-01T00:00:00Z",
  "last_updated": "2026-09-12T00:00:00Z",
  "evaluated_by": "demerzel/pdca-triage-2026-09-12",
  "source_cycle": "gel-compounding-2026-03-18",
  "kaizen_kind": "proactive",
  "outcome": "adopted",
  "act": {
    "decision": "standardize",
    "decided_at": "2026-09-12T00:00:00Z",
    "rationale": "Re-validated 2026-09-12: 18/18 state/evolution/*.evolution.json pass Draft 7 against logic/governance-evolution.schema.json, with its $ref resolved to logic/tetravalent-state.schema.json by $id. The schema-follows-reality superset held through seven new entries added after the check."
  }
}
